{
  "id": "id-en-minusculas-con-guiones",
  "nombre": "Nombre oficial de la organización",
  "siglas": "SIGLAS",
  "ambito": "estatal",
  "ccaa": [],
  "sectores": [],
  "confianza": "sin-datos",
  "web": "https://example.org",
  "revisado": "2026-07-09",
  "advertencia": "La afinidad doctrinal no acredita implantación en tu empresa ni constituye una recomendación de afiliación.",
  "posiciones": {}
}
